{
  "$schema": "../../../../schemas/visual-reference-item.schema.json",
  "schema_version": "1.0.0",
  "id": "dominant-result-01",
  "file": "../images/dominant-result-01.png",
  "role": "dominant-result",
  "asset_geometry": "wide",
  "density": "medium",
  "title_mode": "takeaway",
  "example_content": true,
  "editable_rebuild": true,
  "learn": [
    "大型主图与窄右侧解释区的主次关系",
    "纯白背景上的深蓝中文无衬线层级",
    "少量编号标注与细分隔线的使用"
  ],
  "do_not_copy": [
    "示例标题、数字、曲线和图表标签",
    "示例结论与研究含义",
    "右侧解释区的固定宽度"
  ]
}
