{
  "$schema": "../../../../schemas/visual-reference-item.schema.json",
  "schema_version": "1.0.0",
  "id": "research-question-01",
  "file": "../images/research-question-01.png",
  "role": "research-question",
  "asset_geometry": "diagram",
  "density": "low",
  "title_mode": "topic",
  "example_content": true,
  "editable_rebuild": true,
  "learn": [
    "一个核心问题统领三个从属子问题",
    "大留白中的分支关系与阅读顺序",
    "问题层级依靠字号和连线建立"
  ],
  "do_not_copy": [
    "群落稳定性问题及三个子问题",
    "山水和分子网络背景装饰",
    "三个圆形图标"
  ]
}
