{
  "$schema": "../../../../schemas/visual-reference-item.schema.json",
  "schema_version": "1.0.0",
  "id": "conclusion-02",
  "file": "../images/conclusion-02.png",
  "role": "conclusion",
  "asset_geometry": "diagram",
  "density": "low",
  "title_mode": "takeaway",
  "example_content": true,
  "editable_rebuild": true,
  "learn": [
    "用现象、关键证据和机制解释回扣中心论点",
    "让总结关系比逐条复述更容易记忆",
    "使用少量节点与大留白形成完整结束感"
  ],
  "do_not_copy": [
    "示例现象、证据与机制文字",
    "示例眼睛、文档和网络图标",
    "示例椭圆闭环与节点位置"
  ]
}
