{
  "$schema": "../../../../schemas/visual-reference-item.schema.json",
  "schema_version": "1.0.0",
  "id": "method-design-03",
  "file": "../images/method-design-03.png",
  "role": "method-design",
  "asset_geometry": "process",
  "density": "high",
  "title_mode": "takeaway",
  "example_content": true,
  "editable_rebuild": true,
  "learn": [
    "多源实验输入向特征融合和模型分析汇聚",
    "输入、处理、验证和解释的完整分析管线",
    "不同信息密度模块之间的视觉节奏"
  ],
  "do_not_copy": [
    "显微图、谱图、曲线和模型结果",
    "神经网络及结构关系的科学含义",
    "图标、卡片和箭头的精确组合"
  ]
}
