{
  "$schema": "../../../../schemas/visual-reference-item.schema.json",
  "schema_version": "1.0.0",
  "id": "mechanism-01",
  "file": "../images/mechanism-01.png",
  "role": "mechanism",
  "asset_geometry": "process",
  "density": "medium",
  "title_mode": "takeaway",
  "example_content": true,
  "editable_rebuild": true,
  "learn": [
    "用四阶段因果链解释连续成矿过程",
    "用科学场景示意与简洁箭头共同承担叙事",
    "只突出一个核心转化环节"
  ],
  "do_not_copy": [
    "示例中的硫酸盐还原与铀沉淀结论",
    "示例化学式、物质标签和科学数值",
    "示例地层剖面与微生物插图"
  ]
}
