{
  "$schema": "../../../../schemas/visual-reference-item.schema.json",
  "schema_version": "1.0.0",
  "id": "comparison-01",
  "file": "../images/comparison-01.png",
  "role": "comparison",
  "asset_geometry": "comparison",
  "density": "low",
  "title_mode": "takeaway",
  "example_content": true,
  "editable_rebuild": true,
  "learn": [
    "两张等权显微图的严格对齐比较",
    "一处差异圈选与一句结论的克制表达",
    "证据图占主导的低密度页面"
  ],
  "do_not_copy": [
    "显微结构、比例尺和材料结论",
    "红蓝虚线圈的具体位置",
    "对照样品与改性样品标签"
  ]
}
