{
  "$schema": "../../../../schemas/visual-reference-item.schema.json",
  "schema_version": "1.0.0",
  "id": "method-design-02",
  "file": "../images/method-design-02.png",
  "role": "method-design",
  "asset_geometry": "process",
  "density": "high",
  "title_mode": "takeaway",
  "example_content": true,
  "editable_rebuild": true,
  "learn": [
    "队列、分组、随访和检测的四阶段研究设计",
    "时间轴与分组信息在同一流程中的编排",
    "高密度方法页仍保持明确阅读顺序"
  ],
  "do_not_copy": [
    "样本量、分组、随访时间和组学类型",
    "人物、药片和检测图标",
    "底部辅助流程条的具体内容"
  ]
}
