{
  "$schema": "../../../../schemas/visual-reference-item.schema.json",
  "schema_version": "1.0.0",
  "id": "discussion-outlook-03",
  "file": "../images/discussion-outlook-03.png",
  "role": "discussion-outlook",
  "asset_geometry": "process",
  "density": "high",
  "title_mode": "takeaway",
  "example_content": true,
  "editable_rebuild": true,
  "learn": [
    "从当前结果依次导出未解决问题、关键实验和预期判断",
    "让下一步研究表现为问题驱动的决策链",
    "在高信息量页面中用重复结构维持扫描顺序"
  ],
  "do_not_copy": [
    "示例工程性能与尺度效应内容",
    "示例卡片、图标和箭头的精确组合",
    "示例循环回路和底部总结条"
  ]
}
