{
  "$schema": "../../../../schemas/visual-reference-item.schema.json",
  "schema_version": "1.0.0",
  "id": "conclusion-03",
  "file": "../images/conclusion-03.png",
  "role": "conclusion",
  "asset_geometry": "mixed",
  "density": "medium",
  "title_mode": "takeaway",
  "example_content": true,
  "editable_rebuild": true,
  "learn": [
    "以当前贡献为主、后续方向为辅组织结束页",
    "用不对称区域明确结论与展望的权重差异",
    "让贡献链条和未来工作保持同一视觉系统"
  ],
  "do_not_copy": [
    "示例多源证据框架与后续方向文字",
    "示例数据库、盾牌、靶心和趋势图图标",
    "示例大框和右侧三行列表的精确结构"
  ]
}
