{
  "$schema": "../../../../schemas/visual-reference-item.schema.json",
  "schema_version": "1.0.0",
  "id": "method-design-01",
  "file": "../images/method-design-01.png",
  "role": "method-design",
  "asset_geometry": "process",
  "density": "high",
  "title_mode": "mixed",
  "example_content": true,
  "editable_rebuild": true,
  "learn": [
    "四阶段科学证据链的横向推进",
    "每阶段用真实材料缩略图支持方法说明",
    "底部研究目标对完整流程的收束"
  ],
  "do_not_copy": [
    "野外照片、显微图、同位素图和地质示意",
    "年龄、比值、矿物名称及成矿结论",
    "阶段箭头和目标框的精确样式"
  ]
}
