{
  "$schema": "../../../../schemas/visual-reference-item.schema.json",
  "schema_version": "1.0.0",
  "id": "comparison-02",
  "file": "../images/comparison-02.png",
  "role": "comparison",
  "asset_geometry": "comparison",
  "density": "medium",
  "title_mode": "takeaway",
  "example_content": true,
  "editable_rebuild": true,
  "learn": [
    "三个条件采用共享尺度的横向性能比较",
    "统一图例让观众快速跨面板判断",
    "结论式标题直接统领比较结果"
  ],
  "do_not_copy": [
    "误差曲线、坐标数值和方法名称",
    "弱纹理、动态遮挡和尺度变化标签",
    "三图的具体曲线形态"
  ]
}
