{
  "$schema": "../../../../schemas/visual-reference-item.schema.json",
  "schema_version": "1.0.0",
  "id": "research-question-03",
  "file": "../images/research-question-03.png",
  "role": "research-question",
  "asset_geometry": "process",
  "density": "high",
  "title_mode": "topic",
  "example_content": true,
  "editable_rebuild": true,
  "learn": [
    "核心假设、调节假设与验证路径的对应",
    "上层命题和下层证据路径的清晰分区",
    "高密度页面仍保持蓝白秩序"
  ],
  "do_not_copy": [
    "公众信任假设和验证文案",
    "问卷、实验与行为数据的具体描述",
    "卡片、图标和底部波纹的精确样式"
  ]
}
