{
  "$schema": "../../../../schemas/visual-reference-item.schema.json",
  "schema_version": "1.0.0",
  "id": "multi-panel-03",
  "file": "../images/multi-panel-03.png",
  "role": "multi-panel",
  "asset_geometry": "dense-multi-panel",
  "density": "high",
  "title_mode": "takeaway",
  "example_content": true,
  "editable_rebuild": true,
  "learn": [
    "四张地图构成从局地到区域的时空证据序列",
    "编号、箭头与短说明建立连续阅读方向",
    "底部结论对多面板信息进行一次性收束"
  ],
  "do_not_copy": [
    "地图、物种丰度、比例尺和空间结论",
    "阶段名称与时间演化叙事",
    "箭头和底部结论框的精确样式"
  ]
}
